{
  "schema_version": 1,
  "name": "preview",
  "strict_diagnostics": false,
  "input": {"headings": "literal"},
  "metadata": {"title": "無題", "author": "", "language": "ja"},
  "txt": {"encoding": "utf-8", "newline": "lf"},
  "docx": {
    "page_width_mm": 148, "page_height_mm": 210,
    "margin_mm": {"top": 20, "bottom": 20, "left": 20, "right": 20},
    "font": "Noto Serif CJK JP", "font_size_pt": 12,
    "page_numbers": true, "cover": false, "auto_tcy": true
  },
  "pdf": {
    "page_width_mm": 148, "page_height_mm": 210,
    "margin_mm": {"top": 20, "bottom": 20, "left": 20, "right": 20},
    "font": "Noto Serif CJK JP", "font_size_pt": 12,
    "page_numbers": true, "cover": false, "auto_tcy": true
  },
  "epub": {"font": "Noto Serif CJK JP", "cover": false, "embed_fonts": false, "auto_tcy": true}
}
